{
	"Site": "Nexus",
	"Id": 6620,
	"Name": "SSUL's Shirt Last Version",
	"Author": "Jinjin1221",
	"AuthorLabel": "SSUL",
	"Description": "[b][u]Required Mod\n<br />[/u][/b]\n<br />Json Assets\n<br />[url=https://www.nexusmods.com/stardewvalley/mods/1720]https://www.nexusmods.com/stardewvalley/mods/1720[/url]\n<br />\n<br />SpaceCore\n<br />[url=https://www.nexusmods.com/stardewvalley/mods/1348]https://www.nexusmods.com/stardewvalley/mods/1348[/url]\n<br />​\n<br />\n<br />[b][u]Caution[/u][/b]\n<br />Delete the SSUL's Shirt Mod first and put SSUL's Shirt Last Version in the Mod file.\n<br />\n<br />\n<br />[b][u]More[/u][/b]\n<br />[url=https://blog.naver.com/jj609203/222057921686]https://blog.naver.com/jj609203/222057921686[/url]",
	"PageUrl": "https://www.nexusmods.com/stardewvalley/mods/6620",
	"Version": "1.4.5",
	"Updated": "2020-08-12T00:38:20+00:00",
	"Downloads": [
		{
			"Id": 30061,
			"Type": "Main",
			"DisplayName": "SSUL's Shirt Last Version",
			"FileName": "SSUL's Shirt Last Version-6620-1-4-5-1597192700.zip",
			"Description": "SSUL's Shirt Last Version.\n<br />Make sure to delete the SSUL's Shirt Mod, then put the SSUL's Shirt Last Version Mod.",
			"Version": "1.4.5",
			"SizeInBytes": 70468,
			"Uploaded": "2020-08-12T00:38:20+00:00",
			"Mods": [
				{
					"Id": "SSUL.Shirt.Ver.1",
					"DisplayName": "SSUL Shirt Last Version",
					"Type": "ContentPack",
					"RelativePath": "[JA] SSUL's Shirt Last Version",
					"Manifest": {
						"Name": "SSUL Shirt Last Version",
						"Description": "Add new shirts.",
						"Author": "SSUL",
						"Version": "1.4.5",
						"ContentPackFor": {
							"UniqueId": "spacechase0.JsonAssets"
						},
						"Dependencies": [],
						"UpdateKeys": [
							"Nexus:6620"
						],
						"UniqueId": "SSUL.Shirt.Ver.1"
					}
				}
			],
			"OtherFields": {
				"Uid": 5596342416749,
				"CategoryId": 1,
				"Primary": false
			}
		}
	],
	"OtherFields": {
		"Uid": 5596342393308,
		"UploaderId": 70903188,
		"CategoryId": 13,
		"Adult": false
	}
}