{
	"Site": "Nexus",
	"Id": 31407,
	"Name": "East scarp NPC Sen(Lurking in the dark) - Korean translate",
	"Author": "YJ0709",
	"AuthorLabel": "YJ",
	"Description": "[url=https://www.nexusmods.com/stardewvalley/mods/21690]cheesecats[/url]님의 번역 파일을 기반으로 제작한 번역입니다.[허락해주신 제작자님께 감사드니다! \uD83D\uDE0A]\n<br />Thank you, [url=https://next.nexusmods.com/profile/7thAxis?gameId=1303]7thAxis[/url], for creating such a great mod!\n<br />\n<br />-----------------------------------------------------------------------------------------------------------------------------------------\uFEFF\n<br />[b][u]모드 소개[/u]\n<br />\n<br />[/b]새롭게 추가된 NPC **센(Sen)**은 크로버스와 같은 종족인 [b]그림자[/b]입니다.\n<br />소심하지만 장난기 많고 호기심 넘치는 센과 함께 새로운 이야기를 즐겨보세요!\n<br />-----------------------------------------------------------------------------------------------------------------------------------------\uFEFF\n<br />[b][i][u]이 번역을 적용하려면 아래 두 가지 모드가 반드시 설치되어 있어야 합니다.[/u][/i][/b]\n<br />\n<br />[url=https://www.nexusmods.com/stardewvalley/mods/5787]이스트 스카프[/url][url=https://www.nexusmods.com/stardewvalley/mods/10770]\uFEFF\n<br />Lurking in the dark\n<br />\n<br />[/url]-----------------------------------------------------------------------------------------------------------------------------------------\uFEFF\n<br />[u]설치방법\n<br />\n<br />[/u]1. Mods 폴더에 [b]East Scarp[/b] 모드와 [b]Lurking in the Dark[/b] 모드가 설치되어 있는지 확인합니다.\n<br />2. 번역 파일을 다운로드합니다.\n<br />3. 다운로드한 파일의 압축을 풀고 Mods 폴더에 넣습니다.\n<br />\n<br />*제대로 설치가 되었는지 확인하는법*\n<br />\n<br />스타듀밸리 게임폴더-&gt;Mods-&gt;Lurking in the dark-&gt;i18n 안에 ko.json 파일이 있어야 합니다\n<br />\n<br />-----------------------------------------------------------------------------------------------------------------------------------------\n<br />\uFEFF\n<br />해당 번역은 Lurking in the dark [u]3.0.3[/u] 버전에 맞게 제작되었습니다.\n<br />\n<br />-----------------------------------------------------------------------------------------------------------------------------------------\uFEFF[*][b]첫 번역 작업[/b]이라 어색한 부분이 있을 수 있습니다. 양해 부탁드립니다.\n<br />[*]정기적으로 번역을 제공하는 것은 아니므로, 업데이트가 없거나 텀이 길어질 가능성이 큽니다.\n<br />\n<br /> 추후\u00A0[url=https://next.nexusmods.com/profile/cheesecats/mods?gameId=1303]cheesecats[/url]님의 번역이 업데이트되면, 이 파일은 내려갈 예정입니다.",
	"PageUrl": "https://www.nexusmods.com/stardewvalley/mods/31407",
	"Version": "3.0.3",
	"Updated": "2025-02-02T06:58:35+00:00",
	"Downloads": [
		{
			"Id": 124113,
			"Type": "Main",
			"DisplayName": "Lurking in the Dark - Korean translation",
			"FileName": "Lurking in the Dark - Korean translation-31407-3-0-3-1738479515.zip",
			"Description": "Lurking in the dark 한국어 번역 파일\n<br />\n<br />압축해제 후 안에 있는 Lurking in the dark  폴더를 Mods 폴더 안에 넣어주세요",
			"Version": "3.0.3",
			"SizeInBytes": 69474,
			"Uploaded": "2025-02-02T06:58:35+00:00",
			"Mods": [
				{
					"Id": null,
					"DisplayName": "Lurking in the Dark\\i18n",
					"Type": "Invalid",
					"RelativePath": "Lurking in the Dark\\i18n",
					"ManifestParseError": "ManifestMissing",
					"ManifestParseErrorText": "it contains files, but none of them are manifest.json."
				}
			],
			"OtherFields": {
				"Uid": 5596342510801,
				"CategoryId": 1,
				"Primary": false
			}
		}
	],
	"OtherFields": {
		"Uid": 5596342418095,
		"UploaderId": 198429623,
		"CategoryId": 24,
		"Adult": false
	}
}