{
	"Site": "Nexus",
	"Id": 49631,
	"Name": "MALE CLOTHING - Bonestealer Pack - Outfit Presets FS - Fashion Sence",
	"Author": "marmuruah",
	"Description": "This mod allows you to dress up your farmer as characters from[b]\u00A0Bonestealer[/b]\u00A0using\u00A0[b]Fashion Sense[/b].[b]\u00A0[/b]For convenience, the pack includes presets for 4* complete outfits, but you are free to mix and match individual clothing pieces to create your own combinations if you wish.\u00A0It also includes a few skin tone variations, so you may find it useful even if you're not familiar with the comic.\u00A0I'm sorry there aren't more skin tone options. Including every possible skin tone would have resulted in too many files. If you need a specific one, you can simply open the mod files, find the clothing texture you want, and edit it in Photoshop or any other image editor to match your preferred skin tone.\n<br />\n<br />* - 4, but one of them has 4 variations, so there are 7 presets in total.\n<br />\n<br />[b]The mod includes 7 presets (listed in alphabetical order):\n<br />[/b]\n<br />[list]\n<br />[*][b]Bone[/b]\u00A0(Bone’s outfit)[/*]\n<br />[*][b]Meat[/b] (Meat’s outfit)[/*]\n<br />[*][b]Paralysis[/b]\u00A0(Paralysis’ outfit)[/*]\n<br />[*][b]Soul #1[/b] (Soul's outfit with a hood and a regular face)[/*]\n<br />[*][b]Soul #2[/b] (Soul's outfit without a hood and with a\u00A0regular face) [/*]\n<br />[*][b]Soul #3[/b] (Soul's outfit with a hood and a skeleton face) [/*]\n<br />[*][b]Soul #4[/b]\u00A0(Soul's outfit without a hood and with\u00A0a skeleton face)[/*]\n<br />[/list][b]Individual clothing pieces included in the pack:\n<br />[/b]\n<br />[b]Accessories:[/b]\n<br />[list]\n<br />[*]Bone's mask[/*]\n<br />[*]Meat's mask[/*]\n<br />[*]Paralysis face[/*]\n<br />[*]Blue skeleton\u00A0mask[/*]\n<br />[*]White skeleton mask[/*]\n<br />[/list][b]Hairstyles:[/b]\n<br />[list]\n<br />[*]Bone's hair[/*]\n<br />[*]Meat's hair[/*]\n<br />[*]Paralysis' hair[/*]\n<br />[*]Soul's hair[/*]\n<br />[*]Soul's hair for a hood[/*]\n<br />[*]Soul's hair + mask[/*]\n<br />[*]Soul's hair + mask for a hood [/*]\n<br />[/list][b]Hats:[/b]\n<br />[list]\n<br />[*]Paralysis\u00A0hat [/*]\n<br />[*]Soul's hood[/*]\n<br />[/list][b]Pants:[/b]\n<br />[list]\n<br />[*]Bone's\u00A0black trousers [/*]\n<br />[*]Meats’s grey trousers[/*]\n<br />[*]Paralysis' orange\u00A0trousers[/*]\n<br />[*]Soul’s skeleton\u00A0legs (actually just blue trousers lol)[/*]\n<br />[/list][b]Tops:[/b]\n<br />[list]\n<br />[*]Bone’s black striped vest[/*]\n<br />[*]Meat’s red\u00A0apron[/*]\n<br />[*]Paralysis orange coat (2 vers)[/*]\n<br />[*]Soul's black cloak (2 vers)[/*]\n<br />[/list][b]Sleeves:[/b]\n<br />[list]\n<br />[*]Bone's\u00A0bishop sleeves (has\u00A0different skin tones)[/*]\n<br />[*]Meat's T-shirt sleeves and muscles\u00A0(has different skin tones)[/*]\n<br />[*]Paralysis' orange coat sleeves\u00A0(has different skin tones)[/*]\n<br />[*]Soul's bat cloak sleeves (has different skin tones) [/*]\n<br />[/list]",
	"PageUrl": "https://www.nexusmods.com/stardewvalley/mods/49631",
	"Version": "1.0.0",
	"Updated": "2026-07-24T13:53:18+00:00",
	"Downloads": [
		{
			"Id": 176136,
			"Type": "Main",
			"DisplayName": "Bonestealer Pack",
			"FileName": "72/91/55/7291555c-9794-4345-8828-fc3d0a2b23a2",
			"Description": "",
			"Version": "1.0.0",
			"SizeInBytes": 2231719,
			"Uploaded": "2026-07-24T13:53:18+00:00",
			"Mods": [
				{
					"Id": "marmuruah.BonestealerPack",
					"DisplayName": "Bonestealer Pack",
					"Type": "ContentPack",
					"RelativePath": "[FS] Bonestealer Pack",
					"Manifest": {
						"Name": "Bonestealer Pack",
						"Description": "Bonestealer characters appearance.",
						"Author": "marmuruah",
						"Version": "1.0.0",
						"ContentPackFor": {
							"UniqueId": "PeacefulEnd.FashionSense",
							"MinimumVersion": "7.0.2"
						},
						"Dependencies": [],
						"UpdateKeys": [],
						"UniqueId": "marmuruah.BonestealerPack"
					}
				}
			],
			"OtherFields": {
				"Uid": 5596342562824,
				"CategoryId": 1,
				"Primary": true
			}
		}
	],
	"OtherFields": {
		"Uid": 5596342436319,
		"UploaderId": 261548653,
		"CategoryId": 13,
		"Adult": false
	}
}