{
	"Site": "Nexus",
	"Id": 26579,
	"Name": "Giant Sparrow Plush",
	"Author": "Ballshorse",
	"Description": "Adds in a MASSIVE fat sparrow plush, that looks [i]totally nothing like [/i]a bird from the plushie brand Amuse (please don't sue me Amuse)\n<br />\n<br />This is a kinda tester version of a mod I will be soon releasing with more big round birdies. In this mod it is only the sparrow which you can get from the furniture catalogue.\n<br />\n<br />and thank you to my partner for helping out with the art :)",
	"PageUrl": "https://www.nexusmods.com/stardewvalley/mods/26579",
	"Version": "1.0.0",
	"Updated": "2024-07-31T16:30:27+00:00",
	"Downloads": [
		{
			"Id": 108187,
			"Type": "Main",
			"DisplayName": "Fat Sparrow Plush",
			"FileName": "Fat Sparrow Plush-26579-1-0-0-1722443427.zip",
			"Description": "",
			"Version": "1.0.0",
			"SizeInBytes": 4165,
			"Uploaded": "2024-07-31T16:30:27+00:00",
			"Mods": [
				{
					"Id": "Ballshorse.SparrowPlushCP",
					"DisplayName": "Fat Sparrow Plush",
					"Type": "ContentPack",
					"Manifest": {
						"Name": "Fat Sparrow Plush",
						"Description": "Adds fat fuck",
						"Author": "Ballshorse",
						"Version": "1.0.0",
						"ContentPackFor": {
							"UniqueId": "Pathoschild.ContentPatcher"
						},
						"Dependencies": [],
						"UpdateKeys": [],
						"UniqueId": "Ballshorse.SparrowPlushCP"
					}
				}
			],
			"OtherFields": {
				"Uid": 5596342494875,
				"CategoryId": 1,
				"Primary": false
			}
		}
	],
	"OtherFields": {
		"Uid": 5596342413267,
		"UploaderId": 192269171,
		"CategoryId": 23,
		"Adult": false
	}
}