{
	"Site": "Nexus",
	"Id": 2335,
	"Name": "Black And White Mod",
	"Author": "justin2131",
	"AuthorLabel": "Justin",
	"Description": "Bored with the regular old portraits? The [size=4]Black And White Mod [/size][size=2]turns all of the portraits into a black and white photo, just like in a black and white movie.[/size]\n<br />\n<br />\n<br />[size=2]Requires\u00A0[/size][url=https://smapi.io/]SMAPI[/url][size=2] and\u00A0[/size][url=https://www.nexusmods.com/stardewvalley/mods/1915]Content Patcher[/url]\uFEFF.\n<br />\n<br />[u][size=3]To Install[/size]\n<br />[/u]\n<br />Extract the zip file into StardewValley/Mods/\n<br />Make sure you have [url=https://www.nexusmods.com/stardewvalley/mods/1915]Content Patcher[/url]\uFEFF\u00A0installed so the patches work.",
	"PageUrl": "https://www.nexusmods.com/stardewvalley/mods/2335",
	"Version": "1.0.0",
	"Updated": "2018-06-06T20:38:27+00:00",
	"Downloads": [
		{
			"Id": 9313,
			"Type": "Main",
			"DisplayName": "BlackAndWhite Mod",
			"FileName": "BlackAndWhite Mod-2335-1-0-0.zip",
			"Description": "",
			"Version": "1.0.0",
			"SizeInBytes": 696445,
			"Uploaded": "2018-06-06T20:38:27+00:00",
			"Mods": [
				{
					"Id": "Justin.BlackWhite",
					"DisplayName": "BlackAndWhite",
					"Type": "ContentPack",
					"RelativePath": "[CP] BlackAndWhite",
					"Manifest": {
						"Name": "BlackAndWhite",
						"Description": "Turns all portraits into black and white.",
						"Author": "Justin",
						"Version": "1.0.0",
						"MinimumApiVersion": "2.5.0",
						"ContentPackFor": {
							"UniqueId": "Pathoschild.ContentPatcher"
						},
						"Dependencies": [],
						"UpdateKeys": [],
						"UniqueId": "Justin.BlackWhite"
					}
				}
			],
			"OtherFields": {
				"Uid": 5596342396001,
				"CategoryId": 1,
				"Primary": false
			}
		}
	],
	"OtherFields": {
		"Uid": 5596342389023,
		"UploaderId": 54132177,
		"CategoryId": 6,
		"Adult": false
	}
}