{
	"Site": "Nexus",
	"Id": 46755,
	"Name": "Valley Legacy",
	"Author": "StaRzZz91",
	"Description": "# Valley Legacy\n<br />\n<br />**Valley Legacy** is a long-term progression mod for Stardew Valley. It adds a full Legacy Journal, 100 goals, XP, ranks, Legacy Points, badges, perks, challenges, a separate reward shop, and prestige seasons for players who want their save to keep feeling rewarding.\n<br />\n<br />## Features\n<br />\n<br />- 100 long-term Legacy Goals\n<br />- Farming, Fishing, Mining, Social, Cooking, and Exploration categories\n<br />- Daily Focus, Weekly, and Seasonal challenges\n<br />- Legacy XP and rank titles\n<br />- Legacy Points\n<br />- Claimable rewards\n<br />- Legacy Perks\n<br />- Separate Legacy Reward Shop with categories and rare rewards\n<br />- Legacy Badges and mastery rewards\n<br />- Prestige / Legacy Season system for long-term saves\n<br />- Generic Mod Config Menu support\n<br />- Multilingual i18n starter files\n<br />\n<br />## Controls\n<br />\n<br />- **F10** opens the Legacy Journal\n<br />- **F11** opens the Legacy Reward Shop\n<br />\n<br />Keys can be changed in config or through Generic Mod Config Menu.\n<br />\n<br />## Translation Support\n<br />\n<br />Includes starter i18n files for English, French, German, Spanish, Portuguese, Chinese, Japanese, Korean, and Russian. These are draft starter translations and community improvements are welcome.\n<br />\n<br />## Requirements\n<br />\n<br />- SMAPI\n<br />\n<br />Optional:\n<br />\n<br />- Generic Mod Config Menu\n<br />\n<br />## Compatibility\n<br />\n<br />Valley Legacy does not edit maps or replace vanilla assets. It should be compatible with most mods.\n<br />\n<br /># Compatibility Notes\n<br />\n<br />Valley Legacy is designed to be lightweight and compatibility-friendly.\n<br />\n<br />It does not replace maps, NPCs, items, shops, festivals, or vanilla content. It tracks progression through SMAPI events and shows custom menus.\n<br />\n<br />Potential conflicts:\n<br />\n<br />- Other mods using F10 or F11 by default. Change the keybinds in config or GMCM.\n<br />- Very large UI scaling may make menus feel tighter. Use normal UI scale if possible.\n<br />\n<br />Generic Mod Config Menu is optional, not required.",
	"PageUrl": "https://www.nexusmods.com/stardewvalley/mods/46755",
	"Version": "1",
	"Updated": "2026-05-28T16:47:28+00:00",
	"Downloads": [
		{
			"Id": 169292,
			"Type": "Main",
			"DisplayName": "ValleyLegacy 1.0.7",
			"FileName": "ValleyLegacy 1.0.7-46755-5-1779986848.zip",
			"Description": "",
			"Version": "5",
			"SizeInBytes": 283958,
			"Uploaded": "2026-05-28T16:47:28+00:00",
			"Mods": [
				{
					"Id": "Starzzz.ValleyLegacy",
					"DisplayName": "Valley Legacy",
					"Type": "Smapi",
					"RelativePath": "ValleyLegacy",
					"Manifest": {
						"Name": "Valley Legacy",
						"Description": "Adds a long-term legacy journal with categories, goals, ranks, XP, challenges, Legacy Points, expanded perks, a badge collection, mastery rewards, and a separate reward shop for Stardew Valley.",
						"Author": "starzzz",
						"Version": "1.0.7",
						"MinimumApiVersion": "4.0.0",
						"EntryDll": "ValleyLegacy.dll",
						"Dependencies": [
							{
								"UniqueId": "spacechase0.GenericModConfigMenu",
								"IsRequired": false
							}
						],
						"UpdateKeys": [
							"Nexus:46755"
						],
						"UniqueId": "Starzzz.ValleyLegacy"
					}
				}
			],
			"OtherFields": {
				"Uid": 5596342555980,
				"CategoryId": 1,
				"Primary": true
			}
		}
	],
	"OtherFields": {
		"Uid": 5596342433443,
		"UploaderId": 113189763,
		"CategoryId": 3,
		"Adult": false
	}
}