{
	"Site": "Nexus",
	"Id": 42400,
	"Name": "Grandpa's Toolbelt (PTBR)",
	"Author": "Maatsuki",
	"Description": "[left][/left]\n<br />[img]https://i.postimg.cc/wMFMHCkY/sobre_o_mod2.png[/img]\n<br />[center][b][size=5]\n<br />Você herdou o bem mais precioso do Vovô: seu fiel cinto de ferramentas!\n<br />Esse mod adiciona seis espaços permanentes, separados da sua mochila, para economizar espaço e garantir que você nunca fique na mão sem seus itens mais usados[b]\u00A0[/b]✨[/size][/b][/center]\n<br />\n<br />[center][b][size=5]PÁGINA DO MOD [size=5]✨[/size]\n<br />[/size][size=5][url=https://www.nexusmods.com/stardewvalley/mods/42217][b]Grandpa's Toolbelt\n<br />[/b][/url]\uFEFF\uFEFF\uFEFF\uFEFF\uFEFF\uFEFF\uFEFF\uFEFF\uFEFF\uFEFF\uFEFF\uFEFF\uFEFF\uFEFF\uFEFF\uFEFF\uFEFF\uFEFF\uFEFF\uFEFF\uFEFF\uFEFF\uFEFF\uFEFF\uFEFF\uFEFF\uFEFF\uFEFF\uFEFF\uFEFF\uFEFF\uFEFF\uFEFF\uFEFF\uFEFF\uFEFF\uFEFF\uFEFF\uFEFF\uFEFF\uFEFF\uFEFF\uFEFF\uFEFF\uFEFF\uFEFF\uFEFF\uFEFF\uFEFF\uFEFF\uFEFF\uFEFF\uFEFF\uFEFF\uFEFF\uFEFF\uFEFF\uFEFF\uFEFF\uFEFF\uFEFF\uFEFF\uFEFF\uFEFF\uFEFF\uFEFF\uFEFF\uFEFF\uFEFF\uFEFF\uFEFF\uFEFF\uFEFF\uFEFF\uFEFF\uFEFF\uFEFF\uFEFF\uFEFF\uFEFF\uFEFF\uFEFF\uFEFF\uFEFF\uFEFF\uFEFF\uFEFF\uFEFF\uFEFF\uFEFF\uFEFF\uFEFF\uFEFF\uFEFF\uFEFF\uFEFF\uFEFF\uFEFF[/size]\n<br />\uFEFF\uFEFF\uFEFF\uFEFF\uFEFF\uFEFF\uFEFF\uFEFF\uFEFF\uFEFF\uFEFF\uFEFF\uFEFF\uFEFF\uFEFF\uFEFF\uFEFF\uFEFF\uFEFF\uFEFF\uFEFF\uFEFF[img]https://i.postimg.cc/4ywyZD1G/Info2.png[/img]\n<br />\n<br />\uFEFF[/b][size=5][b]O Mais Lore-Friendly que eu consegui [size=5]✨[/size][/b]\n<br />[b]Revisado novamente antes de ser postado aqui, qualquer errinho será corrigido no futuro [size=5]✨[/size][/b][/size]\n<br /> \n<br />[img]https://i.postimg.cc/QCSCs2qG/Creditos2.png[/img]\uFEFF\n<br /> \n<br />[b][size=5]Criador do Mod Original [size=5]✨[/size][/size][/b]\n<br />[size=5][b][url=https://www.nexusmods.com/stardewvalley/users/19851364]ThatBritishMo[/url]\u00A0|\u00A0imnotashrimp83\n<br />[/b][/size]\n<br />[b][size=5]Criador da Tradução [size=5]✨[/size][/size][/b]\n<br />[size=5][url=https://www.nexusmods.com/users/59340891][b]Maatsuki[/b][/url][/size]\n<br /> \uFEFF [/center]\n<br />\uFEFF\uFEFF[url=https://discord.gg/yfz6pZZ6X6][img]https://i.imgur.com/OMFnY4K.png[/img][/url]\uFEFF\uFEFF\n<br />[center]Visite nosso Discord clicando[url=https://discord.gg/yfz6pZZ6X6] NESTE LINK![/url]\uFEFF Junte-se à melhor comunidade entusiasta de mods de Stardew Valley no Brasil![size=4]\n<br />\u00A0Se você é um tradutor, esteja mais do que convidado a se juntar à nós, será um prazer recebe-lo![/size][/center]\n<br />",
	"PageUrl": "https://www.nexusmods.com/stardewvalley/mods/42400",
	"Version": "2.1.6",
	"Updated": "2026-03-31T22:24:50+00:00",
	"Downloads": [
		{
			"Id": 162978,
			"Type": "Main",
			"DisplayName": "Grandpa's Toolbelt (PTBR)",
			"FileName": "Grandpa's Toolbelt (PTBR)-42400-2-1-6-1774995890.zip",
			"Description": "",
			"Version": "2.1.6",
			"SizeInBytes": 905,
			"Uploaded": "2026-03-31T22:24:50+00:00",
			"Mods": [
				{
					"Id": null,
					"DisplayName": "GrandpasToolbelt\\i18n",
					"Type": "Invalid",
					"RelativePath": "GrandpasToolbelt\\i18n",
					"ManifestParseError": "ManifestMissing",
					"ManifestParseErrorText": "it contains files, but none of them are manifest.json."
				}
			],
			"OtherFields": {
				"Uid": 5596342549666,
				"CategoryId": 1,
				"Primary": true
			}
		}
	],
	"OtherFields": {
		"Uid": 5596342429088,
		"UploaderId": 59340891,
		"CategoryId": 27,
		"Adult": false
	}
}