{
	"Site": "Nexus",
	"Id": 11341,
	"Name": "Happy Birthday PT BR",
	"Author": "Kiyugamods",
	"AuthorLabel": "Kiyuga",
	"Description": "[center][/center]\n<br />[center][font=Comic Sans MS][b][color=#ffe599][size=6]Tradução Completa![/size][/color]\n<br />\n<br />[/b][size=2]Na versão\u00A03.21.4 - Para\u00A0Happy Birthday ([color=#00ff00]Requer[/color])\n<br />Na versão\u00A02.0.4 - Para\u00A0Happy Birthday English Content Pack ([color=#ff0000]Não Requer[/color])[/size]\n<br />\n<br />\n<br />[color=#b6d7a8][size=6][b][img]https://i.imgur.com/S0n9jix.png[/img][/b][/size][/color]\n<br />\n<br />\n<br />[size=4]Você já se perguntou por que você não faz aniversário em Stardew Valley? Bem, não se preocupe mais!\n<br />Este mod permite que você escolha um dia para o seu aniversário. No seu aniversário, você recebera cartas de seus pais, e os aldeões lhe dão presentes e lhe desejaram um feliz aniversário.[/size][/font]\n<br />[font=Comic Sans MS]\n<br />\n<br />[color=#6fa8dc][size=6][b][img]https://i.imgur.com/fuPIcwr.png[/img][/b][/size][/color]\n<br />\n<br />\n<br />[size=5][b]Criador do mod:\u00A0[url=https://www.nexusmods.com/stardewvalley/users/111142118][/url][url=https://www.nexusmods.com/stardewvalley/users/32171640]Ômegase[/url][/b][/size][b][size=5]\uFEFF\uFEFF[url=https://www.nexusmods.com/stardewvalley/users/111722573][/url][url=https://www.nexusmods.com/stardewvalley/users/111142118][/url]\n<br />Tradução:\u00A0Kiyugamods\n<br />\n<br />[color=#ffd966][size=3]Proibido\u00A0Reposta/Copiar/Atualizar \"Minhas\" Traduções sem a minha autorização.\n<br />Sujeito a Denuncia/Report por roubo de propriedade.[/size][/color][/size]\n<br />\n<br />\n<br />[img]https://i.imgur.com/UCaKj8m.png[/img]\n<br />\n<br />[/b]Siga Exatamente na nessa ordem\n<br />(Eu vou pular o básico como SMAPI e Content)\n<br />\n<br />1° Primeiramente\n<br />Baixe o mod Original\n<br />[url=https://www.nexusmods.com/stardewvalley/mods/520]Happy Birthday[/url]\uFEFF\n<br />\n<br />2° Segundo\n<br />Baixe os requisitos\n<br />- [url=https://www.nexusmods.com/stardewvalley/mods/1348]SpaceCore[/url]\uFEFF\n<br />\u00A0-\u00A0[url=https://www.nexusmods.com/stardewvalley/mods/2341]Stardust Core\n<br />\n<br />[/url][color=#ff0000][b]NÃO INSTALE O REQUSITO[/b][/color][/font]\n<br />[font=Comic Sans MS][url=https://www.nexusmods.com/stardewvalley/mods/11148]Happy Birthday English Content Pack\uFEFF\n<br />[/url]\n<br />3° Terceiro\n<br />Baixe a minha a Tradução\n<br />[url=https://www.nexusmods.com/stardewvalley/mods/11341?tab=files]\u00A0Happy Birthday Portugues Content Pack[/url]\uFEFF\n<br />\n<br />4° Quarto\n<br />Coleque o original\u00A0[url=https://www.nexusmods.com/stardewvalley/mods/520]Happy Birthday[/url]\u00A0e requisitos na pasta de /Mods\n<br />Em seguida coloque também a Tradução\u00A0[url=https://www.nexusmods.com/stardewvalley/mods/11341?tab=files]\u00A0Happy Birthday Portugues Content Pack[/url]\u00A0na mesma pasta.\n<br />\n<br />\n<br />Obs: Não precisa substituir nenhum arquivo.\n<br />[b]NÃO\u00A0[/b]precisa e não deve ter\u00A0[url=https://www.nexusmods.com/stardewvalley/mods/11148]English Content Pack[/url]\n<br />\n<br />Tudo certo para funcionar corretamente.[/font]\n<br />\n<br />\n<br />[/center]\n<br />[center][/center]\n<br />[center][b][size=5]===================[/size]\n<br />[size=5]Parceiros no Discord![/size]\n<br />[size=4](Clique na Imagem Para fazer Parte)[/size]\n<br />[size=5]================[/size]\n<br />\n<br />[/b][url=https://discord.gg/yfz6pZZ6X6][b][img]https://i.imgur.com/OMFnY4K.png[/img][/b]\n<br />[/url][/center]\n<br />",
	"PageUrl": "https://www.nexusmods.com/stardewvalley/mods/11341",
	"Version": "3.21.4",
	"Updated": "2026-09-03T01:53:22+00:00",
	"Downloads": [
		{
			"Id": 181243,
			"Type": "Main",
			"DisplayName": "Happy Birthday Portugues Content Pack",
			"FileName": "e6/e9/1b/e6e91b84-ba12-42cd-9941-4ca27c8548f9",
			"Description": "Baixe apenas o Mod Happy Birthday (3.21.4 Versão Mais Atualizada)\n\n- Extraia a tradução na pasta (Stardew Valley/Mods)\nObs: Não precisa ser dentro da pasta do (Mod Happy Birthday).\n\n(Não instale English Content Pack - Esse mod aqui faz o trabalho dele)",
			"Version": "3.21.4",
			"SizeInBytes": 51878,
			"Uploaded": "2026-09-03T01:53:22+00:00",
			"Mods": [
				{
					"Id": "Omegasis.HappyBirthday.ContentPatcher.ContentPack.pt-BR",
					"DisplayName": "Happy Birthday en-US Translation Content Pack",
					"Type": "ContentPack",
					"RelativePath": "[CP] HappyBirthdayContentPack pt-BR",
					"Manifest": {
						"Name": "Happy Birthday en-US Translation Content Pack",
						"Description": "Traduções em português para o mod, Happy Birthday.",
						"Author": "Omegasis",
						"Version": "3.21.4",
						"ContentPackFor": {
							"UniqueId": "Pathoschild.ContentPatcher"
						},
						"Dependencies": [
							{
								"UniqueId": "Omegasis.HappyBirthday",
								"MinimumVersion": "3.21.0",
								"IsRequired": true
							}
						],
						"UpdateKeys": [
							"Nexus:11341"
						],
						"UniqueId": "Omegasis.HappyBirthday.ContentPatcher.ContentPack.pt-BR",
						"OtherFields": {
							"Translator": "Kiyugamods"
						}
					}
				}
			],
			"OtherFields": {
				"Uid": 5596342567931,
				"CategoryId": 1,
				"Primary": true
			}
		}
	],
	"OtherFields": {
		"Uid": 5596342398029,
		"UploaderId": 106092643,
		"CategoryId": 3,
		"Adult": false
	}
}