{
	"Site": "Nexus",
	"Id": 27978,
	"Name": "Taelende's Void Ranch for 1.6",
	"Author": "silvermoonchan",
	"AuthorLabel": "Taelende silvermoonchan",
	"Description": "Permissions for Taelende's\u00A0[url=https://www.nexusmods.com/stardewvalley/mods/2696]Void Ranch[/url]\u00A0were open, so I've taken the liberty of updating it to 1.6!\n<br />\n<br />This mod adds {not replaces!) void versions of all the vanilla animals. They include:\n<br />\n<br />Coop:\n<br />4 varieties of Fancy Void Chickens\n<br />A Void Duck\n<br />A Void Rabbit\n<br />A Void Dinosaur\n<br />\n<br />Barn:\n<br />2 varieties of Void Cow\n<br />A Void Sheep\n<br />A Void Goat\n<br />A Void Pig\n<br />\n<br />All these animals can be purchased from Marnie. The cows, goats, chickens and dino produce vanilla milks and eggs, and the pig digs up truffles like vanilla pigs. The duck lays a vanilla egg but drops a void feather. The sheep and rabbits will provide void wool that can be turned into void cloth, and rabbits drop void rabbit's feet with high friendship.\n<br />\n<br />This mod does NOT include the horse from the original since that was a retexture of the vanilla horse and not a barn or coop animal.\n<br />\n<br />Enjoy!\n<br />\n<br />~Like my work? [url=https://ko-fi.com/silvermoonchan]Buy me a coffee![/url] ☕ ",
	"PageUrl": "https://www.nexusmods.com/stardewvalley/mods/27978",
	"Version": "1.7",
	"Updated": "2026-03-27T03:04:31+00:00",
	"Downloads": [
		{
			"Id": 162282,
			"Type": "Main",
			"DisplayName": "Void Ranch",
			"FileName": "Void Ranch-27978-1-7-1774580671.zip",
			"Description": "format update",
			"Version": "1.7",
			"SizeInBytes": 120231,
			"Uploaded": "2026-03-27T03:04:31+00:00",
			"Mods": [
				{
					"Id": "Taelende.VoidRanch",
					"DisplayName": "Void Ranch",
					"Type": "ContentPack",
					"RelativePath": "Void Ranch\\[CP] Void Ranch",
					"Manifest": {
						"Name": "Void Ranch",
						"Description": "Enter the void. Embrace the void.",
						"Author": "Taelende silvermoonchan",
						"Version": "1.7.0",
						"MinimumApiVersion": "2.6.0",
						"ContentPackFor": {
							"UniqueId": "Pathoschild.ContentPatcher"
						},
						"Dependencies": [],
						"UpdateKeys": [
							"Nexus:27978"
						],
						"UniqueId": "Taelende.VoidRanch"
					}
				}
			],
			"OtherFields": {
				"Uid": 5596342548970,
				"CategoryId": 1,
				"Primary": false
			}
		}
	],
	"OtherFields": {
		"Uid": 5596342414666,
		"UploaderId": 10252540,
		"CategoryId": 7,
		"Adult": false
	}
}