{
	"Site": "Nexus",
	"Id": 35606,
	"Name": "Lnh's Dreamy Island Farm",
	"Author": "liunianhui",
	"Description": "[center][size=4][color=#ffff00]接受地图绘制委托，如果你正在制作mod，需要找人绘制地图，那么请联系我。\n<br />Accept the commission of map drawing. If you are making mod and need to find someone to draw a map, please contact me.[/color]\n<br />\n<br />[color=#00ff00]这个农场不是很大，但是所有地都可以种植。\n<br />有丰富的鱼群，还有2个自定义地图，可以建造农场建筑。\n<br />左下角每天会刷新7个硬木桩，可以在配置中取消刷新。\n<br />默认替换标准农场\n<br />This farm is not big, but all the land can be planted.\n<br />There are many fish species.\n<br />There are also 2 custom maps available for building farm buildings.\n<br />The bottom left corner refreshes 7 hardwood stakes every day.\u00A0Can be disabled in the config file.\n<br />Default replacement of standard farm[/color]\n<br />[color=#ff0000]\n<br />如果你喜欢它，可以点个赞吗？非常感谢\n<br />If you like it, can you endorse it?\u00A0Thank you!\n<br />\n<br />[/color]这是来自群友好久不见的约稿地图，让我在这里发布\n<br />\n<br />[color=#00ffff]b站：[url=https://space.bilibili.com/378625642?spm_id_from=333.1007.0.0]LiuNianHui_Lnh\n<br />[/url]交流群：714558944\n<br />如果你喜欢我的mod，可以[url=https://afdian.com/a/420817996Lnh]请我喝杯咖啡[/url]\uFEFF吗？\n<br />If you like my mod, can you\u00A0[url=https://ko-fi.com/liunianhui]buy me a cup of coffee[/url]\uFEFF\uFEFF?[/color][/size][/center]",
	"PageUrl": "https://www.nexusmods.com/stardewvalley/mods/35606",
	"Version": "1.0.1",
	"Updated": "2025-08-07T04:32:15+00:00",
	"Downloads": [
		{
			"Id": 139393,
			"Type": "Main",
			"DisplayName": "Lnh's Dreamy Island Farm",
			"FileName": "Lnh's Dreamy Island Farm-35606-1-0-1-1754541135.zip",
			"Description": "更新内容在mod主页变更日志里/The updated content is in the mod homepage change logs",
			"Version": "1.0.1",
			"SizeInBytes": 417163,
			"Uploaded": "2025-08-07T04:32:15+00:00",
			"Mods": [
				{
					"Id": "Lnh.DreamyIslandFarm",
					"DisplayName": "Lnh's Dreamy Island Farm",
					"Type": "ContentPack",
					"RelativePath": "Lnh's Dreamy Island Farm",
					"Manifest": {
						"Name": "Lnh's Dreamy Island Farm",
						"Description": "",
						"Author": "Lnh",
						"Version": "1.0.1",
						"ContentPackFor": {
							"UniqueId": "Pathoschild.ContentPatcher"
						},
						"Dependencies": [],
						"UpdateKeys": [
							"Nexus:35606"
						],
						"UniqueId": "Lnh.DreamyIslandFarm"
					}
				}
			],
			"OtherFields": {
				"Uid": 5596342526081,
				"CategoryId": 1,
				"Primary": false
			}
		}
	],
	"OtherFields": {
		"Uid": 5596342422294,
		"UploaderId": 91684178,
		"CategoryId": 21,
		"Adult": false
	}
}