{
	"Site": "Nexus",
	"Id": 27303,
	"Name": "Fence Expanded (Spanish)",
	"Author": "Hayato2236",
	"AuthorLabel": "Zexu2K y Hayato2236",
	"Description": "[center][b]\uFEFF(Las imágenes son solo ilustrativas, en el juego las verán en español)[/b]\n<br />\n<br />Utilice [b]el catálogo de vallas[/b] para obtener [b]nuevas vallas\u00A0[/b]\n<br />\n<br />[b][size=4]¡Que puedes comprar en la carpintería de Robin![/size][/b]\n<br />\n<br />[b]Lista de vallas nuevas:[/b]\n<br />\n<br />[img]https://i.postimg.cc/nzjg1K6H/fenlist.png[/img]\uFEFF\n<br />\n<br />[b]Cómo se ven:[/b]\n<br />\n<br />[img]https://i.postimg.cc/g0B1RttS/fen.png[/img]\uFEFF\n<br />\n<br />[img]https://i.postimg.cc/pTbYgDmV/dsadsadsadsad.png[/img]\uFEFF\n<br />\n<br />[b][size=4]Revisa sus otros mod (de verdad, míralos, están geniales):[/size][/b]\n<br />\n<br />[size=5]-\u00A0[url=https://www.nexusmods.com/stardewvalley/mods/25838]Monster Energy Drink's\n<br />[/url]-\u00A0[url=https://www.nexusmods.com/stardewvalley/mods/25080]Fast Eat\n<br />[/url]-\u00A0[url=https://www.nexusmods.com/stardewvalley/mods/27265]Battery Robot\n<br />[/url]\uFEFF-\u00A0[url=https://www.nexusmods.com/stardewvalley/mods/26887]Repice Researcher\n<br />[/url]\uFEFF- \uFEFF[url=https://www.nexusmods.com/stardewvalley/mods/26498]Ancient Seed Expanded\n<br />\n<br />[/url][/size][b]Instalación de la traducción[/b]\n<br />Descarga, descomprime y copia la carpeta\u00A0[b]Fence Expanded[/b] en [b][i]stardew vallewy/mods[/i][/b], reemplaza si lo solicita\u00A0[/center]",
	"PageUrl": "https://www.nexusmods.com/stardewvalley/mods/27303",
	"Version": "1.4.1",
	"Updated": "2025-05-16T03:11:46+00:00",
	"Downloads": [
		{
			"Id": 132371,
			"Type": "Main",
			"DisplayName": "Fence Expanded Spanish v1.4.1",
			"FileName": "Fence Expanded Spanish v1.4.1-27303-1-4-1-1747365106.zip",
			"Description": "Corregido un error de tipeo",
			"Version": "1.4.1",
			"SizeInBytes": 1667,
			"Uploaded": "2025-05-16T03:11:46+00:00",
			"Mods": [
				{
					"Id": null,
					"DisplayName": "Fence Expanded\\Fence Expanded\\[CP] Fence Expanded\\i18n",
					"Type": "Invalid",
					"RelativePath": "Fence Expanded\\Fence Expanded\\[CP] Fence Expanded\\i18n",
					"ManifestParseError": "ManifestMissing",
					"ManifestParseErrorText": "it contains files, but none of them are manifest.json."
				}
			],
			"OtherFields": {
				"Uid": 5596342519059,
				"CategoryId": 1,
				"Primary": false
			}
		}
	],
	"OtherFields": {
		"Uid": 5596342413991,
		"UploaderId": 180180273,
		"CategoryId": 7,
		"Adult": false
	}
}