{
	"Site": "Nexus",
	"Id": 33023,
	"Name": "West Coast North America bird pack PT-BR",
	"Author": "runangiejar",
	"Description": "A [b]Guilda dos Ornitólogos[/b] traz uma experiência totalmente nova de observação de aves para [i]Stardew Valley[/i], completa com mecânicas reformuladas para os pássaros, comedouros e banheiras, aves sazonais, ninhos e filhotes, um sistema de progressão, uma nova localização e loja, um novo NPC com um passado trágico, e muuuito mais! Você tem o que é preciso para se tornar o próximo grande observador de aves de Pelican Town?\n<br />\n<br />[b]Pacotes de Aves[/b] \n<br /> Novo! [b]Aves da Costa Oeste da América do Norte[/b] (Este) \n<br />[b]Aves Eurasianas[/b] por Mazout \n<br /> [b]Aves de Arrbyte[/b] \n<br /> [b]Pacote de Parulídeos do GCWA[/b]",
	"PageUrl": "https://www.nexusmods.com/stardewvalley/mods/33023",
	"Version": "1.0.0",
	"Updated": "2025-04-20T23:24:22+00:00",
	"Downloads": [
		{
			"Id": 130529,
			"Type": "Main",
			"DisplayName": "OG West Coast Birds PT-BR",
			"FileName": "OG West Coast Birds PT-BR-33023-1-0-1-1745191462.zip",
			"Description": "Basta extraí-lo para a pasta mods e substituir os arquivos",
			"Version": "1.0.1",
			"SizeInBytes": 7176,
			"Uploaded": "2025-04-20T23:24:22+00:00",
			"Mods": [
				{
					"Id": null,
					"DisplayName": "[OG] West Coast Birds PT-BR\\[OG] West Coast Birds\\i18n",
					"Type": "Invalid",
					"RelativePath": "[OG] West Coast Birds PT-BR\\[OG] West Coast Birds\\i18n",
					"ManifestParseError": "ManifestMissing",
					"ManifestParseErrorText": "it contains files, but none of them are manifest.json."
				}
			],
			"OtherFields": {
				"Uid": 5596342517217,
				"CategoryId": 1,
				"Primary": false
			}
		}
	],
	"OtherFields": {
		"Uid": 5596342419711,
		"UploaderId": 77711448,
		"CategoryId": 7,
		"Adult": false
	}
}