{
	"Site": "Nexus",
	"Id": 29775,
	"Name": "(CP) Wraith Butterfly Trinket",
	"Author": "xtobefreex",
	"Description": "[u][b]OVERVIEW:[/b][/u]\n<br />This mod is a retexture for the fairy trinket that you unlock and have a chance to find after reaching the weapons mastery.\u00A0\n<br />\n<br />The mod uses the winter glow butterfly sprites that are already in the game, but they are recoloured and with lower transparency to give a more ethereal feel to them.\n<br />\n<br />[center][size=4][b][u]\n<br />VERSION 2.0.0 HAS RELEASED![/u][/b]\n<br />[/size]\uFEFF\n<br />\n<br />I've added a toggle between an altered winter glow butterfly and my own glowing butterfly texture. This can be toggled within the GMCM in game or in the config file that is created after loading the game. The default sprite is the one that I created, but I've kept the original for those who may like it better.\n<br />\n<br />\n<br />\n<br />[img]https://staticdelivery.nexusmods.com/mods/1303/images/29775/29775-1742441867-1893175995.gif[/img]\u00A0[b][u]\n<br />[/u][/b]\n<br />[img]https://staticdelivery.nexusmods.com/mods/1303/images/29775/29775-1742441867-1457678890.gif[/img]\uFEFF\uFEFF\n<br />\n<br />\n<br />[u]An optional file called [b]Wraith Butterfly Trinket Standalone [/b]has been included.[/u] This allows the game to drop a trinket called the Crystal Ring, which will then spawn the wraith butterflies when equipped. The butterflies glow and heal like the fairies do. This mod has a toggle that toggles between the fairies being shown and the wraith butterflies being shown, as the wraith butterflies will replace the fairies. I couldn't figure that one out for the life of me, sorry guys. And please let me know if you run into any issues!\n<br />\n<br />[u][img]https://cdn.bsky.app/img/feed_fullsize/plain/did:plc:bojdpdviokjhfedou2msqhkk/bafkreieycgzwwq7bdplv5mhrspk45qyfbsqs7ekvprlaxzs2fsbwgkrjy4@jpeg[/img][/u]\n<br />[b]\n<br />[u]Only have one version of the Wraith Butterfly Trinket installed at a time! Either download the main file, or the optional file.[/u][/b][/center]\n<br />\n<br />[u][b]Installation:[/b][/u]\n<br />1. Make sure you have the latest versions of\u00A0[url=https://www.nexusmods.com/stardewvalley/mods/2400]SMAPI[/url]\u00A0and\u00A0[url=https://www.nexusmods.com/stardewvalley/mods/1915]Content Patcher[/url]\u00A0installed. [url=https://www.nexusmods.com/stardewvalley/mods/5098]Generic Mod Config Menu[/url] is not required but is recommended.\n<br />2. Unzip the folder into[font=Courier New]\u00A0Stardew Valley/Mods[/font]\n<br />3. Run the game through the SMAPI launcher.\n<br />\n<br />[u][b]Compatibility:[/b][/u]\n<br />[list]\n<br />[*]This mod is intended for Stardew Valley version 1.6 or later versions.\u00A0\n<br />[*]This mod has been tested in single-player and works perfectly fine; multiplayer has not been tested but\u00A0[i]should[/i]\u00A0work. Please make sure all players have the mod to prevent possible errors.\n<br />[*]If you have any mods that retexture the fairy trinket, there will be conflicts. Please only use one fairy trinket retexture mod.\n<br />[/list]",
	"PageUrl": "https://www.nexusmods.com/stardewvalley/mods/29775",
	"Version": "2.0.0",
	"Updated": "2025-04-23T16:35:47+00:00",
	"Downloads": [
		{
			"Id": 127877,
			"Type": "Main",
			"DisplayName": "(CP) Wraith Butterfly Trinket",
			"FileName": "(CP) Wraith Butterfly Trinket-29775-2-0-0-1742440142.zip",
			"Description": "The main version of this mod. Download the optional version instead of this one if you want a Crystal Ring trinket! This one only replaces the fairies with the fairy box trinket.",
			"Version": "2.0.0",
			"SizeInBytes": 4808,
			"Uploaded": "2025-03-20T03:09:02+00:00",
			"Mods": [
				{
					"Id": "xtobefreex.WraithButterflyTrinket",
					"DisplayName": "Wraith Butterfly Trinket",
					"Type": "ContentPack",
					"RelativePath": "[CP] Wraith Butterfly Trinket",
					"Manifest": {
						"Name": "Wraith Butterfly Trinket",
						"Description": "Replaces the fairy trinket's fairy sprite with a glowing butterfly texture.",
						"Author": "xtobefreex",
						"Version": "2.0.0",
						"ContentPackFor": {
							"UniqueId": "Pathoschild.ContentPatcher"
						},
						"Dependencies": [],
						"UpdateKeys": [
							"Nexus: 29775"
						],
						"UniqueId": "xtobefreex.WraithButterflyTrinket"
					}
				}
			],
			"OtherFields": {
				"Uid": 5596342514565,
				"CategoryId": 1,
				"Primary": false
			}
		},
		{
			"Id": 130800,
			"Type": "Optional",
			"DisplayName": "(CP) Wraith Butterfly Trinket Standalone",
			"FileName": "(CP) Wraith Butterfly Trinket Standalone-29775-2-0-0-1745426147.zip",
			"Description": "This is an optional file. It creates a new item called the Crystal Ring that will spawn the Wraith Butterflies and heals and glows like the fairies do. DO NOT have both this and the main mod installed. Only choose one! Still replaces the fairy textures.",
			"Version": "2.0.0",
			"SizeInBytes": 5767,
			"Uploaded": "2025-04-23T16:35:47+00:00",
			"Mods": [
				{
					"Id": "xtobefreex.WBTrinketStandalone",
					"DisplayName": "Wraith Butterfly Trinket -- Standalone",
					"Type": "ContentPack",
					"RelativePath": "[CP] Wraith Butterfly Trinket Standalone",
					"Manifest": {
						"Name": "Wraith Butterfly Trinket -- Standalone",
						"Description": "A standalone trinket that uses a glowing butterfly texture.",
						"Author": "xtobefreex",
						"Version": "2.0.0",
						"ContentPackFor": {
							"UniqueId": "Pathoschild.ContentPatcher"
						},
						"Dependencies": [],
						"UpdateKeys": [
							"Nexus: 29775"
						],
						"UniqueId": "xtobefreex.WBTrinketStandalone"
					}
				}
			],
			"OtherFields": {
				"Uid": 5596342517488,
				"CategoryId": 3,
				"Primary": false
			}
		}
	],
	"OtherFields": {
		"Uid": 5596342416463,
		"UploaderId": 79600733,
		"CategoryId": 25,
		"Adult": false
	}
}