{
	"Site": "Nexus",
	"Id": 22930,
	"Name": "Beachside Livestock",
	"Author": "soysauceicecream",
	"Description": "I like the beach farm and wanted animals to match my surroundings. I will upload content patcher versions once I figure that out.\n<br />\n<br />Installation:\n<br />- Download the file\n<br />- navigate to your stardew content folder, commonly within your steamapps folder, open the folder titled 'Animals'\n<br />- Backup your files\n<br />- Drag and drop the xnb files into your Animals folder, replacing existing files\n<br />\n<br />\n<br />The chickens become goldfish\n<br />The cows become manatees\n<br />The sheep become seals\n<br />The goats become seahorses\n<br />The pigs become pink dolphins\n<br />The rabbits become sea bunnies\n<br />The dinosaurs become turtles wearing pirate hats\n<br />The ducks become rubber ducks",
	"PageUrl": "https://www.nexusmods.com/stardewvalley/mods/22930",
	"Version": "1.0.0",
	"Updated": "2024-04-21T00:54:23+00:00",
	"Downloads": [
		{
			"Id": 94063,
			"Type": "Main",
			"DisplayName": "Beachside Livestock",
			"FileName": "Beachside Livestock-22930-1-0-0-1713660863.zip",
			"Description": "",
			"Version": "1.0.0",
			"SizeInBytes": 73116,
			"Uploaded": "2024-04-21T00:54:23+00:00",
			"Mods": [
				{
					"Id": null,
					"DisplayName": "Beachside Livestock",
					"Type": "Xnb",
					"RelativePath": "Beachside Livestock",
					"ManifestParseError": "XnbMod",
					"ManifestParseErrorText": "it's not a SMAPI mod (see https://smapi.io/xnb for info)."
				}
			],
			"OtherFields": {
				"Uid": 5596342480751,
				"CategoryId": 1,
				"Primary": false
			}
		}
	],
	"OtherFields": {
		"Uid": 5596342409618,
		"UploaderId": 208185981,
		"CategoryId": 7,
		"Adult": false
	}
}