{
	"Site": "Nexus",
	"Id": 22097,
	"Name": "Peachy Objects 1.6 items variation",
	"Author": "Lun1e",
	"AuthorLabel": "Lunie",
	"Description": "[color=#ea9999][b][u]UPDATE![/u][/b][/color]\n<br />\n<br />[size=3][url=https://www.nexusmods.com/stardewvalley/mods/4908]Peachy Objects[/url]\u00A0has now been officially updated! I’m leaving this up for people who want slightly different colours than the official version, but please feel free to remove this mod from your mod list and just get the latest version of Peachy Objects from\u00A0[url=https://www.nexusmods.com/stardewvalley/users/42583370]Peachitto[/url]\uFEFF! ♥️ \n<br />I won't make any more changes to this mod as it's fulfilled its purpose and is no longer needed.[/size]\n<br />\n<br />This is a very basic mod that applies colours changes to Peachy Objects\u00A0icons for jelly, pickles, wine, and juice to make use of 1.6's new colours inclusion.\n<br />All credit to\u00A0[url=https://www.nexusmods.com/stardewvalley/users/42583370]Peachitto[/url]\uFEFF's original mod [url=https://www.nexusmods.com/stardewvalley/mods/4908]Peachy Objects[/url] and [url=https://www.nexusmods.com/stardewvalley/users/8170278]Cheerybelle[/url] for\u00A0\uFEFF[url=https://www.nexusmods.com/stardewvalley/mods/20755]SCAGI[/url]\uFEFF which is what I used as a base for this one.",
	"PageUrl": "https://www.nexusmods.com/stardewvalley/mods/22097",
	"Version": "1.0.1",
	"Updated": "2024-04-08T19:48:51+00:00",
	"Downloads": [
		{
			"Id": 90473,
			"Type": "Main",
			"DisplayName": "Peachy Objects 1.6",
			"FileName": "Peachy Objects 1.6-22097-1-0-1-1712605731.zip",
			"Description": "Main file, requires Content Patcher.",
			"Version": "1.0.1",
			"SizeInBytes": 7522,
			"Uploaded": "2024-04-08T19:48:51+00:00",
			"Mods": [
				{
					"Id": "Lunie.PeachyObjectsfix",
					"DisplayName": "Peachy Objects 1.6 fix",
					"Type": "ContentPack",
					"RelativePath": "[CP] Peachy Objects 1.6 fix",
					"Manifest": {
						"Name": "Peachy Objects 1.6 fix",
						"Description": "This fixes the icons for jelly, pickles, wine, juice, and honey to match Peachy Objects with 1.6's new colour mode.",
						"Author": "Lunie",
						"Version": "1.0.1",
						"MinimumApiVersion": "2.2.0",
						"ContentPackFor": {
							"UniqueId": "Pathoschild.ContentPatcher",
							"MinimumVersion": "1.3.0"
						},
						"Dependencies": [],
						"UpdateKeys": [
							"Nexus:22097"
						],
						"UniqueId": "Lunie.PeachyObjectsfix"
					}
				}
			],
			"OtherFields": {
				"Uid": 5596342477161,
				"CategoryId": 1,
				"Primary": false
			}
		}
	],
	"OtherFields": {
		"Uid": 5596342408785,
		"UploaderId": 187810446,
		"CategoryId": 15,
		"Adult": false
	}
}