{
	"Site": "CurseForge",
	"Id": 1554084,
	"Name": "JP's PaiNT Anime Girls Portraits 2",
	"Author": "Juanpa98ar",
	"PageUrl": "https://www.curseforge.com/stardewvalley/mods/jps-paint-anime-girls-portraits-2",
	"Version": null,
	"Updated": "2026-05-26T11:12:13.013+00:00",
	"Downloads": [
		{
			"Id": 8146503,
			"Type": "Main",
			"DisplayName": "[CP] PaiNT Anime Portraits 2.zip",
			"FileName": "[CP] PaiNT Anime Portraits 2.zip",
			"Version": null,
			"SizeInBytes": 51129654,
			"Uploaded": "2026-05-26T01:09:54.643+00:00",
			"Mods": [
				{
					"Id": "Juanpa98ar.PAP2",
					"DisplayName": "(JP98) PaiNT Anime Portraits 2",
					"Type": "ContentPack",
					"RelativePath": "[CP] PaiNT Anime Portraits 2",
					"Manifest": {
						"Name": "(JP98) PaiNT Anime Portraits 2",
						"Description": "Anime HD Portraits",
						"Author": "Juanpa98ar",
						"Version": "1.0.0",
						"ContentPackFor": {
							"UniqueId": "Pathoschild.ContentPatcher"
						},
						"Dependencies": [
							{
								"UniqueId": "Juanpa98ar.Code.ShinHDPortraits",
								"IsRequired": true
							}
						],
						"UpdateKeys": [
							"Nexus:46709"
						],
						"UniqueId": "Juanpa98ar.PAP2"
					}
				}
			],
			"OtherFields": {
				"ReleaseType": 1,
				"FileGroupType": 0,
				"gameVersions": [
					"1.6"
				]
			}
		}
	],
	"OtherFields": {
		"Authors": [
			{
				"Id": 139070942,
				"Name": "Juanpa98ar"
			}
		],
		"DateCreated": "2026-05-26T11:02:27.393+00:00",
		"DateReleased": "2026-05-26T01:09:54.643+00:00",
		"DateModified": "2026-05-26T11:12:13.013+00:00",
		"slug": "jps-paint-anime-girls-portraits-2"
	}
}