{
	"Site": "Nexus",
	"Id": 32448,
	"Name": "Alpacas (KOR)",
	"Author": "JA3B2",
	"Description": "원본 모드 : [url=http://https://www.nexusmods.com/stardewvalley/mods/8515?tab=files]Alpacas[/url]\n<br />원 모드 제작자 :\u00A0[url=http://https://next.nexusmods.com/profile/omena007]omena007[/url]\n<br />한글 패치 제작자 : JA3B2 (온제비) / 디스코드 : ja3b2\n<br />\n<br />\n<br />Alpacas 모드의 한글 패치 파일입니다.\n<br />원본 다운로드 후 한글 패치를 다운로드 받아 원본 모드 i18n 폴더에 넣어주세요.\n<br />\n<br />\n<br />오탈자, 오역, 기타 오류에 관한 문의는 디스코드 혹은 카페 혹은 넥서스 모드로 보내주시면 감사하겠습니다.\n<br />\n<br />\n<br />[url=https://www.nexusmods.com/stardewvalley/users/78732158]Schamarchs[/url]님의\u00A0[url=http://https://www.nexusmods.com/stardewvalley/mods/29582?tab=files]Moe Alpacas[/url] 모드를 활용해 알파카의 색상을 더욱 다양하게 만들 수 있습니다.",
	"PageUrl": "https://www.nexusmods.com/stardewvalley/mods/32448",
	"Version": "2.2",
	"Updated": "2025-03-17T05:22:33+00:00",
	"Downloads": [
		{
			"Id": 127646,
			"Type": "Main",
			"DisplayName": "Alpacas (KOR)",
			"FileName": "Alpacas (KOR)-32448-2-2-1742188953.zip",
			"Description": "ZIP 파일 압축을 푼 후 '원본 모드 폴더' 중 i18n 폴더에 넣으면 됩니다.",
			"Version": "2.2",
			"SizeInBytes": 431,
			"Uploaded": "2025-03-17T05:22:33+00:00",
			"Mods": [
				{
					"Id": null,
					"DisplayName": "127646",
					"Type": "Invalid",
					"ManifestParseError": "ManifestMissing",
					"ManifestParseErrorText": "it contains files, but none of them are manifest.json."
				}
			],
			"OtherFields": {
				"Uid": 5596342514334,
				"CategoryId": 1,
				"Primary": false
			}
		}
	],
	"OtherFields": {
		"Uid": 5596342419136,
		"UploaderId": 216711583,
		"CategoryId": 7,
		"Adult": false
	}
}