{
	"Site": "Nexus",
	"Id": 34352,
	"Name": "Fall Paintings",
	"Author": "Zexu2K",
	"Description": "[size=5][size=5][center][b]Add\u00A0[/b]a few [b]new\u00A0[/b][color=#e69138][b]fall-themed\u00A0[/b][/color][b]paintings\u00A0[/b]to the game![/center][/size][img]https://i.postimg.cc/wTsFm6Rh/banner80.png[/img]\uFEFF\n<br />(Almost every painting has\u00A0a unique colored frame, replacing the standard orange one, with both versions available in the catalog!)\n<br />\n<br />[/size][center][size=5][b]N[/b][b]ew catalog[/b]\u00A0[img]https://i.postimg.cc/J7SvgYb5/cat.png[/img]\u00A0buyable\u00A0in\u00A0[color=#e69138][b]carpenter[/b]\u00A0[/color]shop!\u00A0\uFEFF[/size][/center][size=5][size=6]\n<br />[/size]\n<br />[center][size=5]Check out other mods from the seasons series\uFEFF:\n<br />[/size]*[url=https://www.nexusmods.com/stardewvalley/mods/29965]Winter Paintings[/url]\uFEFF[url=https://www.nexusmods.com/stardewvalley/mods/30126][size=5]\n<br />[color=#ffffff]*[/color]Spring Paintings\n<br />[/size][/url]\uFEFF[/center][/size][size=4]For\u00A0[b]android\u00A0[/b]players use\u00A0[url=https://www.nexusmods.com/stardewvalley/mods/34457]this[/url]\uFEFF, Allows you to access all my catalogues while playing on pc or android, make sure you download the correct version for your device.[/size]",
	"PageUrl": "https://www.nexusmods.com/stardewvalley/mods/34352",
	"Version": "1.1",
	"Updated": "2025-06-15T10:25:39+00:00",
	"Downloads": [
		{
			"Id": 134727,
			"Type": "Main",
			"DisplayName": "Fall Paintings",
			"FileName": "Fall Paintings-34352-1-1-1749983139.zip",
			"Description": "Fixes",
			"Version": "1.1",
			"SizeInBytes": 123454,
			"Uploaded": "2025-06-15T10:25:39+00:00",
			"Mods": [
				{
					"Id": "Zexu2K.Fall_Paintings_by_Zexu2K_CP",
					"DisplayName": "Fall Paintings",
					"Type": "ContentPack",
					"RelativePath": "Fall Paintings\\[CP] Fall Paintings",
					"Manifest": {
						"Name": "Fall Paintings",
						"Description": "Adds Fall Paintings to the game",
						"Author": "Zexu2K",
						"Version": "1.1.0",
						"ContentPackFor": {
							"UniqueId": "Pathoschild.ContentPatcher"
						},
						"Dependencies": [],
						"UpdateKeys": [
							"Nexus:34352"
						],
						"UniqueId": "Zexu2K.Fall_Paintings_by_Zexu2K_CP"
					}
				},
				{
					"Id": "Zexu2K.Fall_Paintings_by_Zexu2K_C",
					"DisplayName": "Fall Paintings",
					"Type": "Smapi",
					"RelativePath": "Fall Paintings\\[C] Fall Paintings",
					"Manifest": {
						"Name": "Fall Paintings",
						"Description": "Adds Catalog for Fall Paintings",
						"Author": "Zexu2K",
						"Version": "1.1.0",
						"MinimumApiVersion": "3.0.0",
						"EntryDll": "Fall Paintings.dll",
						"Dependencies": [
							{
								"UniqueId": "Zexu2K.Fall_Paintings_by_Zexu2K_CP",
								"IsRequired": true
							}
						],
						"UpdateKeys": [
							"Nexus:34352"
						],
						"UniqueId": "Zexu2K.Fall_Paintings_by_Zexu2K_C"
					}
				}
			],
			"OtherFields": {
				"Uid": 5596342521415,
				"CategoryId": 1,
				"Primary": false
			}
		}
	],
	"OtherFields": {
		"Uid": 5596342421040,
		"UploaderId": 55430287,
		"CategoryId": 23,
		"Adult": false
	}
}